{
  "tl_url": "https://lote.credimi.io/lists/eu_credimi_wrprc_trust_registry_infrastruct/latest/lote.jades",
  "tl_url_json": "https://lote.credimi.io/lists/eu_credimi_wrprc_trust_registry_infrastruct/latest/lote.json",
  "trust_anchor": "-----BEGIN CERTIFICATE-----\nMIICfjCCAiSgAwIBAgIUd+nAY0mKz1FSJYIhDwOibv7wtX4wCgYIKoZIzj0EAwIw\ngY0xCzAJBgNVBAYTAkVVMTQwMgYDVQQKDCtDcmVkaW1pIFdSUFJDIFRydXN0IFJl\nZ2lzdHJ5IEluZnJhc3RydWN0dXJlMUgwRgYDVQQDDD9DcmVkaW1pIFdSUFJDIFRy\ndXN0IFJlZ2lzdHJ5IEluZnJhc3RydWN0dXJlIFRydXN0ZWQgTGlzdCBTaWduZXIw\nHhcNMjYwODA0MTMyNTUwWhcNMjcwODA0MTMyNTUwWjCBjTELMAkGA1UEBhMCRVUx\nNDAyBgNVBAoMK0NyZWRpbWkgV1JQUkMgVHJ1c3QgUmVnaXN0cnkgSW5mcmFzdHJ1\nY3R1cmUxSDBGBgNVBAMMP0NyZWRpbWkgV1JQUkMgVHJ1c3QgUmVnaXN0cnkgSW5m\ncmFzdHJ1Y3R1cmUgVHJ1c3RlZCBMaXN0IFNpZ25lcjBZMBMGByqGSM49AgEGCCqG\nSM49AwEHA0IABPLvp1BCDp781mlJK8GOfJzpZ7nr6HX1o8po4YyRU5I2IInYPauU\n4PIXeYvs7Qu9kZzsTfkclf5jBVzTd9vzqmqjYDBeMB8GA1UdIwQYMBaAFDGy/aKP\n386tbc4+WWmGoRoS7kikMAwGA1UdEwEB/wQCMAAwDgYDVR0PAQH/BAQDAgeAMB0G\nA1UdDgQWBBQxsv2ij9/OrW3OPllphqEaEu5IpDAKBggqhkjOPQQDAgNIADBFAiBJ\nWbdJx0j6iW/Nk5wyugRKKM34BnyXVyHnQkOHggBO2gIhAMIdlx7XhJVni74xveck\nOjuTiIOpU8l02LSS4rxtTeEp\n-----END CERTIFICATE-----\n",
  "metadata": {
    "operator_name": "Credimi WRPRC Trust Registry Infrastructure",
    "country": "EU"
  }
}
