{
  "tl_url": "https://trustlist.nxd.foundation/trust-lists/NXD-TL-QEAA.xml",
  "tl_url_xml": "https://trustlist.nxd.foundation/trust-lists/NXD-TL-QEAA.xml",
  "trust_anchor": "-----BEGIN CERTIFICATE-----\nMIIBoDCCAUagAwIBAgIUeQPc75dyOVwCJVf0X5gtsJ8tkbMwCgYIKoZIzj0EAwIw\nJjELMAkGA1UEBhMCU0UxFzAVBgNVBAoMDk5YRCBGb3VuZGF0aW9uMB4XDTI2MDky\nMTA5NDgzOVoXDTI5MDkyMDA5NTMzOVowJjELMAkGA1UEBhMCU0UxFzAVBgNVBAoM\nDk5YRCBGb3VuZGF0aW9uMFkwEwYHKoZIzj0CAQYIKoZIzj0DAQcDQgAEQVTqk6oG\nWN4G15IcOeW27Pp4Akfu54kGaoT1JNNAJbnB7v3zZu1o/9/gHoyrN6Yyu9ww0dAU\nxsWPQFcq2/+U56NSMFAwDgYDVR0PAQH/BAQDAgbAMBEGA1UdJQQKMAgGBgQAkTcD\nADAMBgNVHRMBAf8EAjAAMB0GA1UdDgQWBBQVww37whbwN3DMilF8pSAtQRgIsTAK\nBggqhkjOPQQDAgNIADBFAiBR4C7Tiv94JRayfJ19gggyj68PjdfOfHuCe0Y6B9Gg\nJgIhAKIw81dJK5lGBZXM2d3FSfKAmYH1TpK3TEAjxeZenO4S\n-----END CERTIFICATE-----\n",
  "metadata": {
    "operator_name": "NXD Foundation",
    "country": "SE"
  }
}
